{
  "$schema": "http://json-schema.org/draft-04/schema#",
  "type": "object",
  "properties": {
    "id": {
      "type": "string"
    },
    "first_name": {
      "type": "string"
    },
    "last_name": {
      "type": "string"
    },
    "email": {
      "type": "string"
    },
    "jobs": {
      "type": "array",
      "items": [
        {
          "type": "string"
        },
        {
          "type": "string"
        }
      ]
    },
    "marks": {
      "type": "array",
      "items": [
        {
          "type": "object",
          "properties": {
            "Hindi": {
              "type": "integer"
            },
            "English": {
              "type": "integer"
            }
          },
          "required": [
            "Hindi",
            "English"
          ]
        },
        {
          "type": "object",
          "properties": {
            "Hindi": {
              "type": "integer"
            },
            "English": {
              "type": "integer"
            }
          },
          "required": [
            "Hindi",
            "English"
          ]
        }
      ]
    },
    "favFoods": {
      "type": "object",
      "properties": {
        "breakfast": {
          "type": "string"
        },
        "lunch": {
          "type": "string"
        },
        "dinner": {
          "type": "array",
          "items": [
            {
              "type": "string"
            },
            {
              "type": "string"
            }
          ]
        }
      },
      "required": [
        "breakfast",
        "lunch",
        "dinner"
      ]
    }
  },
  "required": [
    "id",
    "first_name",
    "last_name",
    "email",
    "jobs",
    "marks",
    "favFoods"
  ]
}